{
  "message_id": "fcore-py-2026-04-25-0002",
  "schema_type": "slice_result_packet",
  "schema_version": "1.0.0",
  "project": "fractal-core",
  "from_role": "python-team",
  "to_role": "architect",
  "created_at": "2026-04-25T12:45:00Z",
  "correlation_id": "issue-8",
  "github_context": {
    "repo": "billyweisberg/fractal-core-python",
    "issue_number": 8,
    "pr_number": 9,
    "branch": "codex/issue-8-compact-trace-divergence",
    "links": [
      "https://github.com/billyweisberg/fractal-core-python/issues/8",
      "https://github.com/billyweisberg/fractal-core-python/pull/9"
    ]
  },
  "payload": {
    "issue": {
      "number": 8,
      "url": "https://github.com/billyweisberg/fractal-core-python/issues/8"
    },
    "branch": {
      "name": "codex/issue-8-compact-trace-divergence"
    },
    "pr": {
      "number": 9,
      "url": "https://github.com/billyweisberg/fractal-core-python/pull/9",
      "ready_for_review": true
    },
    "workflow_compliance": {
      "closes_issue": true,
      "issue_side_update_comment_added": true,
      "dev_did_not_merge": true
    },
    "result_summary": {
      "goals": "49 / 49",
      "goal_delta": 0,
      "first_divergence_step": 9002,
      "remaining_failure": "one late-run arbitration divergence",
      "failed_checkpoint_final_metric_counters": 0
    },
    "mechanism_changed": "aligned late-run layer arbitration and composite selection near the divergence window",
    "validation": {
      "ruff": "passed",
      "mypy": "passed",
      "pytest": "passed",
      "commands": [
        "uv run ruff check .",
        "uv run mypy src",
        "uv run --extra dev pytest -q"
      ]
    },
    "artifacts": [
      "/tmp/baby7-issue8-trace-10000.json",
      "/tmp/baby7-issue8-parity-10000.json",
      "/tmp/baby7-issue8-diagnostics-10000.json"
    ],
    "merge_status": {
      "merged": false,
      "ready_for_architect_review": true
    },
    "architect_decision_needed": "review PR #9 for acceptance and merge readiness"
  },
  "authority_context": {
    "manifest_path": "/Users/billyweisberg/.codex/authority/fractal-core-python/current/fractal-core-python-authority.json",
    "authority_version": "2026-04-27.2",
    "milestone_id": "m1-reference-implementation",
    "phase_id": "p5-proving-artifact-maturity",
    "task_id": "py-p2-compact-trace-divergence"
  }
}
